{
    "$schema": "./_.schema.json",
    "addToServer": "Ajouter au serveur",
    "appDirectory": "Répertoire des applications",
    "supportServer": "Serveur d'assistance",
    "website": "Site web",
    "error": "Erreur",
    "command.autoroles.description": "Attribue automatiquement des rôles aux nouveaux membres",
    "command.autoroles.add.description": "Ajouter un nouveau rôle Automatique",
    "command.autoroles.add.role.description": "Sélectionnez un rôle",
    "command.autoroles.add.reply.error.everyone": "Vous ne pouvez pas définir @everyone comme rôle automatique.",
    "command.autoroles.add.reply.error.managed": "Ce rôle est géré par une autre application et ne peut pas être attribué manuellement.",
    "command.autoroles.add.reply.error.position": "Mes permissions sont insuffisantes pour attribuer le rôle automatique. Assurez-vous que l'un de mes rôles est supérieur à [role].",
    "command.autoroles.add.reply.error.alreadyUsed": "[role] est déjà un rôle automatique.",
    "command.autoroles.add.reply.success": "[role] est désormais un rôle automatique.",
    "command.autoroles.remove.description": "Supprime un rôle automatique",
    "command.autoroles.remove.role.description": "Sélectionnez un rôle",
    "command.autoroles.remove.reply.error.notUsed": "[role] n'est actuellement pas un rôle automatique.",
    "command.autoroles.remove.reply.success": "[role] n'est plus un rôle automatique.",
    "command.autoroles.list.description": "Affiche les rôles automatiques actuels",
    "command.autoroles.list.raw.description": "Génére vos rôles automatiques sous forme de fichier texte brut",
    "command.autoroles.list.reply.empty": "Ce serveur n'a aucun rôle automatique.",
    "command.autoroles.list.reply.warn.tooLong": "La liste dépasse la limite de caractères. Veuillez utiliser l'option de commande `raw`.",
    "command.stickyroles.description": "Réattribue les rôles aux utilisateurs au cas où ils quitteraient votre serveur et le rejoindraient à nouveau",
    "command.stickyroles.add.description": "Ajoute un nouveau rôle collant",
    "command.stickyroles.add.role.description": "Sélectionnez un role",
    "command.stickyroles.add.reply.error.everyone": "Vous ne pouvez pas définir @everyone comme rôle collant.",
    "command.stickyroles.add.reply.error.managed": "Ce rôle est géré par une autre application et ne peut pas être attribué manuellement.",
    "command.stickyroles.add.reply.error.position": "Mes permissions sont insuffisantes pour attribuer le rôle collant. Assurez-vous que l'un de mes rôles est supérieur à [role].",
    "command.stickyroles.add.reply.error.alreadyUsed": "[role] est déjà un rôle collant.",
    "command.stickyroles.add.reply.success": "[role] est désormais un rôle collant.",
    "command.stickyroles.remove.description": "Supprime un rôle collant",
    "command.stickyroles.remove.role.description": "Sélectionnez un rôle",
    "command.stickyroles.remove.reply.error.notUsed": "[role] n'est actuellement pas un rôle collant.",
    "command.stickyroles.remove.reply.success": "[role] n'est plus un rôle collant.",
    "command.stickyroles.list.description": "Affiche les rôles collants actuels",
    "command.stickyroles.list.raw.description": "Génère vos rôles collants sous forme de fichier texte brut",
    "command.stickyroles.list.reply.empty": "Ce serveur n'a aucun rôle collant.",
    "command.stickyroles.list.reply.warn.tooLong": "La liste dépasse la limite de caractères. Veuillez utiliser l'option de commande `raw`.",
    "command.connectroles.description": "Connecte des rôles enfants à un rôle parent qui sera attribué automatiquement",
    "command.connectroles.add.description": "Ajouter une nouvelle connexion de rôle",
    "command.connectroles.add.childRole.description": "Sélectionnez le rôle enfant",
    "command.connectroles.add.parentRole.description": "Sélectionnez le rôle parent",
    "command.connectroles.add.reply.error.sameRoles": "Les rôles sélectionnés sont les mêmes.",
    "command.connectroles.add.reply.error.everyone": "Vous ne pouvez connecter @everyone.",
    "command.connectroles.add.reply.error.managed": "[role] est géré par une autre application et ne peut pas être attribué manuellement.",
    "command.connectroles.add.reply.error.position": "Mes permissions sont insuffisantes pour attribuer le rôle parent. Assurez-vous que l'un de mes rôles est supérieur à [role].",
    "command.connectroles.add.reply.error.childAlreadyConnected": "[role] est déjà connecté à un rôle parent.",
    "command.connectroles.add.reply.error.childAlreadyParent": "[role] est déjà connecté à un rôle parent.",
    "command.connectroles.add.reply.error.childAlreadyParentOfParent": "[parent] est déjà le rôle parent de [child]",
    "command.connectroles.add.reply.error.parentAlreadyChild": "[role] est déjà connecté à un rôle parent.",
    "command.connectroles.add.reply.success": "[child] est désormais un rôle enfant de [parent]",
    "command.connectroles.remove.description": "Supprime une connexion de rôle",
    "command.connectroles.remove.role.description": "Sélectionnez un rôle parent ou un rôle enfant",
    "command.connectroles.remove.reply.error.notConnected": "[role] n'est actuellement pas connecté.",
    "command.connectroles.remove.reply.success.childRemoved": "[role] a été déconnecté de son rôle parent.",
    "command.connectroles.remove.reply.success.parentRemoved": "Tous les rôles enfants de [role] ont été déconnectés.",
    "command.connectroles.list.description": "Afficher les connexions de rôle actuelles",
    "command.connectroles.list.raw.description": "Génére vos connexions de rôle sous forme de fichier texte `raw`",
    "command.connectroles.list.reply.empty": "Ce serveur n'a aucune connexion de rôle.",
    "command.connectroles.list.reply.warn.tooLong": "La liste dépasse la limite de caractères. Veuillez utiliser l'option de commande `raw`.",
    "command.connectroles.sync.description": "Synchronise les connexions de rôle - nécessaire uniquement si vous (dé)connectez des rôles déjà attribués",
    "command.connectroles.sync.reply.changes": "Changements",
    "command.connectroles.sync.reply.progress": "Progrès",
    "command.connectroles.sync.reply.start": "Synchronisation des connexions de rôle ...",
    "command.connectroles.sync.reply.finish": "Connexions de rôle synchronisées",
    "command.help.description": "À propos de moi",
    "command.help.reply.title": "Roles — Aide",
    "command.help.reply.description": "Nous publions des tutoriels de fonctionnalités sur notre **[chaîne YouTube](https://www.youtube.com/@rolesbot)**.",
    "command.help.reply.footer": "Développé par @pauel et @leonbrn",
    "command.help.reply.field1.name": "Rôles de Connexion — /connectroles",
    "command.help.reply.field1.value": "Connectez plusieurs rôles enfants à un rôle parent pour améliorer l'apparence et l'organisation de votre serveur..",
    "command.help.reply.field2.name": "Rôles Automatiques — /autoroles",
    "command.help.reply.field2.value": "Attribuez automatiquement des rôles aux nouveaux membres, en respectant les règles de filtrage.",
    "command.help.reply.field3.name": "Rôles Collants — /stickyroles",
    "command.help.reply.field3.value": "Réattribuez les rôles aux utilisateurs au cas où ils quitteraient votre serveur et le rejoindraient à nouveau.",
    "command.onCooldown": "Vous pouvez réutiliser cette commande [rtime].",
    "command.error": "**Une erreur s'est produite.** Veuillez réessayer plus tard ou contactez-nous sur notre serveur d'assistance.",
    "permission.required.all.text": "Toutes les permissions requises sont accordées.",
    "permission.required.missing.title": "Permissions manquantes",
    "permission.required.missing.text": "Le bot nécessite les permissions suivantes pour fonctionner correctement: [permissions]. Vous pouvez les attribuer manuellement au rôle de bot dans les paramètres de votre serveur ou ré-autoriser le bot ci-dessous.",
    "permission.required.reauthorize": "Ré-autoriser"
}
