{
    "$schema": "./_.schema.json",
    "addToServer": "Aggiungi al server",
    "appDirectory": "App Directory",
    "supportServer": "Server di supporto",
    "website": "Sito web",
    "error": "Errore",
    "command.autoroles.description": "Assegna automaticamente ruoli ai nuovi utenti",
    "command.autoroles.add.description": "Aggiungi un nuovo Auto Role",
    "command.autoroles.add.role.description": "Seleziona un ruolo",
    "command.autoroles.add.reply.error.everyone": "Non puoi impostare @everyone come Auto Role.",
    "command.autoroles.add.reply.error.managed": "Questo ruolo è gestito da un'altra applicazione, non può essere assegnato manualmente.",
    "command.autoroles.add.reply.error.position": "I miei permessi non sono sufficienti per assegnare questo ruolo. Assicurati che almeno uno dei miei ruoli sia sopra [role].",
    "command.autoroles.add.reply.error.alreadyUsed": "[role] è già un Auto Role.",
    "command.autoroles.add.reply.success": "[role] è ora un Auto Role.",
    "command.autoroles.remove.description": "Rimuovi un Auto Role",
    "command.autoroles.remove.role.description": "Seleziona un ruolo",
    "command.autoroles.remove.reply.error.notUsed": "[role] non è un Auto Role.",
    "command.autoroles.remove.reply.success": "[role] non è più un Auto Role.",
    "command.autoroles.list.description": "Mostra gli Auto Role configurati",
    "command.autoroles.list.raw.description": "Esporta i tuoi Auto Role in un file di testo",
    "command.autoroles.list.reply.empty": "Questo server non ha Auto Role.",
    "command.autoroles.list.reply.warn.tooLong": "La lista supera il limite di caratteri massimo. Seleziona l'opzione `raw` eseguendo nuovamente il comando.",
    "command.stickyroles.description": "Riassegna dei ruoli agli utenti che escono e rientrano nel server",
    "command.stickyroles.add.description": "Aggiungi un nuovo Sticky Role",
    "command.stickyroles.add.role.description": "Seleziona un ruolo",
    "command.stickyroles.add.reply.error.everyone": "Non puoi impostare @everyone come Sticky Role.",
    "command.stickyroles.add.reply.error.managed": "Questo ruolo è gestito da un'altra applicazione, non può essere assegnato manualmente.",
    "command.stickyroles.add.reply.error.position": "I miei permessi non sono sufficienti per assegnare questo ruolo. Assicurati che almeno uno dei miei ruoli sia sopra [role].",
    "command.stickyroles.add.reply.error.alreadyUsed": "[role] è già uno Sticky Role.",
    "command.stickyroles.add.reply.success": "[role] è ora uno Sticky Role.",
    "command.stickyroles.remove.description": "Rimuovi uno Sticky Role",
    "command.stickyroles.remove.role.description": "Seleziona un ruolo",
    "command.stickyroles.remove.reply.error.notUsed": "[role] non è uno Sticky Role.",
    "command.stickyroles.remove.reply.success": "[role] non è più uno Sticky Role.",
    "command.stickyroles.list.description": "Mostra gli Sticky Role configurati",
    "command.stickyroles.list.raw.description": "Esporta i tuoi Sticky Role in un file di testo",
    "command.stickyroles.list.reply.empty": "Questo server non ha Sticky Role.",
    "command.stickyroles.list.reply.warn.tooLong": "La lista supera il limite di caratteri massimo. Seleziona l'opzione `raw` eseguendo nuovamente il comando.",
    "command.connectroles.description": "Collega ruoli figli a dei ruoli padre che verranno assegnati automaticamente",
    "command.connectroles.add.description": "Aggiungi una nuova Role Connection",
    "command.connectroles.add.childRole.description": "Seleziona il ruolo figlio",
    "command.connectroles.add.parentRole.description": "Seleziona il ruolo padre",
    "command.connectroles.add.reply.error.sameRoles": "Hai selezionato due ruoli uguali.",
    "command.connectroles.add.reply.error.everyone": "Non puoi collegare il ruolo @everyone.",
    "command.connectroles.add.reply.error.managed": "[role] è gestito da un'altra applicazione, non può essere assegnato manualmente.",
    "command.connectroles.add.reply.error.position": "I miei permessi non sono sufficienti per assegnare il ruolo padre. Assicurati che almeno uno dei miei ruoli sia sopra [role].",
    "command.connectroles.add.reply.error.childAlreadyConnected": "[role] è già collegato ad un ruolo padre.",
    "command.connectroles.add.reply.error.childAlreadyParent": "[role] è già configurato come un ruolo padre.",
    "command.connectroles.add.reply.error.childAlreadyParentOfParent": "[parent] è già il ruolo padre di [child].",
    "command.connectroles.add.reply.error.parentAlreadyChild": "[role] è già configurato come un ruolo figlio.",
    "command.connectroles.add.reply.success": "[child] è ora un ruolo figlio di [parent].",
    "command.connectroles.remove.description": "Rimuovi una Role Connection",
    "command.connectroles.remove.role.description": "Seleziona un ruolo figlio o un ruolo padre",
    "command.connectroles.remove.reply.error.notConnected": "[role] non è collegato a nessun altro ruolo.",
    "command.connectroles.remove.reply.success.childRemoved": "[role] è stato scollegato dal suo ruolo padre.",
    "command.connectroles.remove.reply.success.parentRemoved": "Tutti i ruoli figli di [role] sono stati scollegati.",
    "command.connectroles.list.description": "Mostra le Role Connection configurate",
    "command.connectroles.list.raw.description": "Esporta le tue Role Connection in un file di testo",
    "command.connectroles.list.reply.empty": "Questo server non ha Role Connection.",
    "command.connectroles.list.reply.warn.tooLong": "La lista supera il limite di caratteri massimo. Seleziona l'opzione `raw` eseguendo nuovamente il comando.",
    "command.connectroles.sync.description": "Sincronizza le Role Connection - necessario solo se hai (s)collegato ruoli già assegnati",
    "command.connectroles.sync.reply.changes": "Cambiamenti",
    "command.connectroles.sync.reply.progress": "Progresso",
    "command.connectroles.sync.reply.start": "Sincronizzando le Role Connection ...",
    "command.connectroles.sync.reply.finish": "Role Connection sincronizzate",
    "command.help.description": "Informazioni utili",
    "command.help.reply.title": "Roles — Help",
    "command.help.reply.description": "Pubblichiamo dei tutorial sul nostro **[canale YouTube](https://www.youtube.com/@rolesbot)**.",
    "command.help.reply.footer": "Sviluppato da @pauel e @leonbrn",
    "command.help.reply.field1.name": "Role Connection — /connectroles",
    "command.help.reply.field1.value": "Collega diversi ruoli figli ad un ruolo padre, in modo tale da assegnare il ruolo padre automaticamente quando un utente ottiene uno dei ruoli figli.",
    "command.help.reply.field2.name": "Auto Role — /autoroles",
    "command.help.reply.field2.value": "Assegna automaticamente dei ruoli ai nuovi membri, dopo aver accettato le regole del server.",
    "command.help.reply.field3.name": "Sticky Role — /stickyroles",
    "command.help.reply.field3.value": "Configura dei ruoli che verranno riassegnati quando un utente esce e rientra nel server.",
    "command.onCooldown": "Potrai usare nuovamente questo comando [rtime].",
    "command.error": "**Qualcosa è andato storto.** Riprova più tardi o contattaci nel nostro server di supporto.",
    "permission.required.all.text": "Tutti i permessi necessari sono stati forniti.",
    "permission.required.missing.title": "Permessi mancanti",
    "permission.required.missing.text": "Il bot necessita dei seguenti permessi per funzionare correttamente: [permissions]. Puoi assegnarli bot manualmente al ruolo del bot nelle impostazioni del server, oppure autorizzare nuovamente il bot qua sotto.",
    "permission.required.reauthorize": "Autorizza"
}