{
    "$schema": "./_.schema.json",
    "addToServer": "Добавить на сервер",
    "appDirectory": "Каталог Приложений",
    "supportServer": "Сервер Поддержки",
    "website": "Сайт",
    "error": "Ошибка",
    "command.autoroles.description": "Автоматически назначать роли новым участникам",
    "command.autoroles.add.description": "Добавить Auto Role",
    "command.autoroles.add.role.description": "Выберите роль",
    "command.autoroles.add.reply.error.everyone": "Вы не можете поставить @everyone Auto role.",
    "command.autoroles.add.reply.error.managed": "Эта роль приложения, вы не можете назначить её.",
    "command.autoroles.add.reply.error.position": "У меня недостаточно прав для назначения Auto Roles. Убедитесь, что какая-либо из моих ролей выше [role].",
    "command.autoroles.add.reply.error.alreadyUsed": "[role] уже Auto Role.",
    "command.autoroles.add.reply.success": "[role] теперь Auto Role.",
    "command.autoroles.remove.description": "Убрать Auto Role",
    "command.autoroles.remove.role.description": "Выберите роль",
    "command.autoroles.remove.reply.error.notUsed": "[role] не является Auto Role.",
    "command.autoroles.remove.reply.success": "[role] больше не Auto Role.",
    "command.autoroles.list.description": "Все текущие Auto Roles",
    "command.autoroles.list.raw.description": "Вывести все Auto Roles в текстовый файл",
    "command.autoroles.list.reply.empty": "У данного сервера нету Auto Roles.",
    "command.autoroles.list.reply.warn.tooLong": "Количество символов в списке превышает допустимое. Пожалуйста, используйте команду `raw`.",
    "command.stickyroles.description": "Назначить роли участников, если они вышли и вошли на сервер снова",
    "command.stickyroles.add.description": "Добавить новую Sticky Role",
    "command.stickyroles.add.role.description": "Выберите роль",
    "command.stickyroles.add.reply.error.everyone": "Вы не можете поставить @everyone Sticky Role.",
    "command.stickyroles.add.reply.error.managed": "Эта роль приложения, вы не можете назначить её.",
    "command.stickyroles.add.reply.error.position": "У меня недостаточно прав для назначения Sticky Role. Убедитесь, что какая-либо из моих ролей выше [role].",
    "command.stickyroles.add.reply.error.alreadyUsed": "[role] уже Sticky Role.",
    "command.stickyroles.add.reply.success": "[role] теперь Sticky Role.",
    "command.stickyroles.remove.description": "Убрать Sticky Role",
    "command.stickyroles.remove.role.description": "Выберете",
    "command.stickyroles.remove.reply.error.notUsed": "[role] не является Sticky Role.",
    "command.stickyroles.remove.reply.success": "[role] больше не Sticky Role.",
    "command.stickyroles.list.description": "Все текущие Sticky Roles",
    "command.stickyroles.list.raw.description": "Вывести все Sticky Roles в текстовый файл",
    "command.stickyroles.list.reply.empty": "Сервер не имеет Sticky Roles.",
    "command.stickyroles.list.reply.warn.tooLong": "Количество символов в списке превышает допустимое. Пожалуйста, используйте команду `raw`.",
    "command.connectroles.description": "Подключите дочерние роли к родительской, которая будет назначена автоматически.",
    "command.connectroles.add.description": "Добавить новую Role Connection",
    "command.connectroles.add.childRole.description": "Выберите дочерную роль",
    "command.connectroles.add.parentRole.description": "Выберите родительскую роль",
    "command.connectroles.add.reply.error.sameRoles": "Выбранные роли одинаковые.",
    "command.connectroles.add.reply.error.everyone": "Вы не можете выбрать @everyone.",
    "command.connectroles.add.reply.error.managed": "[role] является приложением и не может быть выбрана",
    "command.connectroles.add.reply.error.position": "У меня недостаточно прав для назначения родительской роли. Убедитесь, что какая-либо из моих ролей выше [role].",
    "command.connectroles.add.reply.error.childAlreadyConnected": "[role] уже подключена к родительской роли.",
    "command.connectroles.add.reply.error.childAlreadyParent": "[role] уже подключена к родительской роли.",
    "command.connectroles.add.reply.error.childAlreadyParentOfParent": "[parent] же подключена к родительской роли если [child]",
    "command.connectroles.add.reply.error.parentAlreadyChild": "[role] уже подключена к родительской роли.",
    "command.connectroles.add.reply.success": "[child] теперь дочерняя роль по отношению к [parent]",
    "command.connectroles.remove.description": "Убрать Role Connection",
    "command.connectroles.remove.role.description": "Выберите родительскую или дочерную роль",
    "command.connectroles.remove.reply.error.notConnected": "[role] в данный момент не подключена.",
    "command.connectroles.remove.reply.success.childRemoved": "[role] была  отключена от родительской роли",
    "command.connectroles.remove.reply.success.parentRemoved": "Все дочерние роли [role] были отключены.",
    "command.connectroles.list.description": "Все текущие Role Connections",
    "command.connectroles.list.raw.description": "Вывести все Role Connections в текстовый файл",
    "command.connectroles.list.reply.empty": "Этот сервер не имеет Role Connections.",
    "command.connectroles.list.reply.warn.tooLong": "Количество символов в списке превышает допустимое. Пожалуйста, используйте команду `raw`.",
    "command.connectroles.sync.description": "Синхронизация Role Connections - только если вы отключили/подключили уже распределённые роли",
    "command.connectroles.sync.reply.changes": "Изменения",
    "command.connectroles.sync.reply.progress": "Програсс",
    "command.connectroles.sync.reply.start": "Синхронизация Role Connections ...",
    "command.connectroles.sync.reply.finish": "Синхронизация Role Connections прошла успешно",
    "command.help.description": "Обо мне",
    "command.help.reply.title": "Roles — Помощь",
    "command.help.reply.description": "Мы публикуем туториалы на **[YouTube канале](https://www.youtube.com/@rolesbot)**.",
    "command.help.reply.footer": "Разработаны @pauel и @leonbrn",
    "command.help.reply.field1.name": "Connection Roles — /connectroles",
    "command.help.reply.field1.value": "Подключите несколько дочерних ролей к родительской, чтобы улучшить внешний вид и организацию вашего сервера.",
    "command.help.reply.field2.name": "Auto Roles — /autoroles",
    "command.help.reply.field2.value": "Назначайте Auto Roles новым участникам соблюдая правила",
    "command.help.reply.field3.name": "Sticky Roles — /stickyroles",
    "command.help.reply.field3.value": "Назначте роли участников, если они вышли и вошли на сервер снова",
    "command.onCooldown": "Вы можете использовать команду снова через [rtime].",
    "command.error": "**Произошла ошибка** Попробуйте снова позже или свяжитесь с нами через сервер поддержки",
    "permission.required.all.text": "Все необходимые права предоставлены.",
    "permission.required.missing.title": "Отсутствуют необходимое(ые) права",
    "permission.required.missing.text": "Для правильной работы, боту требуются следующие разрешения: [permissions]. Вы можете назначить их вручную или повторно авторизовать бота ниже.",
    "permission.required.reauthorize": "Повторная авторизация"
}